experiment	agent_iteration	commit	time_us	status	description
1	15	HEAD	2612.11	keep	Baseline 'previous_best' — initial benchmark
2	16	HEAD	227341.21	discard	Advisor proposed replacing multi-step attention with SDPA. Implemented by materializing explicit K [
3	17	HEAD	167099.07	discard	Advisor proposed a Flash-Attention-style fused Triton kernel that streams kv_nope once per (batch, h
4	18	HEAD	10096.04	discard	Advisor proposed torch.compile with reduce-overhead mode on the core attention compute (_mla_core), 
5	19	HEAD	33765.06	discard	Advisor proposed replacing M = attn @ kv_nope (cuBLAS) with a tiled Triton GEMV kernel that tiles DK
6	20	HEAD	2655.78	discard	Advisor proposed CUDA Graph capture per kv_len to eliminate kernel dispatch overhead. Implemented CU
7	21	HEAD	2655.11	discard	Advisor proposed caching contiguous pre-transposed weight tensors (wK, wV_T, wDQ+wDKV fused) to elim
8	22	HEAD	2587.85	keep	Advisor proposed using flash_attn_func with GQA (1 KV head, head_dim=dkv=512) to fuse the nope score
9	23	HEAD	2607.70	discard	Advisor proposed: (1) verify scale correctness in flash_attn call, (2) eliminate _rotate_half torch.
10	24	HEAD	2630.24	discard	Advisor proposed combining nope+rope into single flash_attn call with head_dim=576 (dkv+d_rope), GQA
11	25	HEAD	2731.89	discard	Advisor proposed clean up of #8 approach: strip dead Triton kernels (weighted_sum, flash_attn_kernel
